{
  "cluster": "examples.4",
  "summary": "Six example suites (HTLC, its UplcBlaster proofs, Escrow, Factory, EditableNft, LinkedList) and the validators and off-chain builders they test. The cluster is cheap after P1: LinkedListTest dropped from 62.9 s to about 6.2 s (F-19), every other suite takes 1.4 s or less, so CI savings are small and come only from merging LinkedList properties. HTLC is the reference: its proofs cover every validator branch, and HtlcTest pins the error messages. The others have gaps that the suite names hide. The Escrow 'wrong signer' tests never reach the signature checks, so deleting them leaves the suite green. EditableNft and LinkedList negative tests accept any submit failure, and their setup submits go unchecked, so a broken setup step makes them pass. FactoryExample/FactoryContract is never compiled by any test, and LinkedList's SpendForUpdate path has no test or builder in the whole repository. Code duplication is high in FactoryTest (13 copies of the same fixtures), LinkedListTest (20 UTxO-fetch chains, 5 copies of the insert loop) and EditableNftValidatorTest. No main-code defect was found.",
  "behaviors": [
    {
      "pass": "HtlcValidator",
      "name": "receiver reveals the preimage up to the timeout (budget pinned, JVM and UPLC agree)",
      "tests": [
        "scalus-examples/jvm/src/test/scala/scalus/examples/htlc/HtlcTest.scala:67-114",
        "scalus-examples/jvm/src/test/scala/scalus/examples/htlc/HtlcVerificationTest.scala:579-644"
      ]
    },
    {
      "pass": "HtlcValidator",
      "name": "reveal rejections: wrong preimage, wrong signer, range ends after timeout, no upper bound",
      "tests": [
        "scalus-examples/jvm/src/test/scala/scalus/examples/htlc/HtlcTest.scala:116-171",
        "scalus-examples/jvm/src/test/scala/scalus/examples/htlc/HtlcVerificationTest.scala:388-577"
      ]
    },
    {
      "pass": "HtlcValidator",
      "name": "committer refunds from the timeout on; refund rejections: other signer, before timeout, no lower bound",
      "tests": [
        "scalus-examples/jvm/src/test/scala/scalus/examples/htlc/HtlcTest.scala:173-230",
        "scalus-examples/jvm/src/test/scala/scalus/examples/htlc/HtlcVerificationTest.scala:238-384"
      ]
    },
    {
      "pass": "HtlcValidator",
      "name": "rejects a context that is not spending, an output without datum, an unknown redeemer",
      "tests": [
        "scalus-examples/jvm/src/test/scala/scalus/examples/htlc/HtlcVerificationTest.scala:194-234"
      ]
    },
    {
      "pass": "HtlcValidator",
      "name": "reveal and refund windows are disjoint; bound closure does not matter; sample spends on the Lean machine",
      "tests": [
        "scalus-examples/jvm/src/test/scala/scalus/examples/htlc/HtlcVerificationTest.scala:648-784"
      ]
    },
    {
      "pass": "HtlcVerificationTest helpers",
      "name": "contexts written from Data equal the ledger encoding",
      "tests": [
        "scalus-examples/jvm/src/test/scala/scalus/examples/htlc/HtlcVerificationTest.scala:122-192"
      ]
    },
    {
      "pass": "HtlcTransactions / HtlcContract",
      "name": "lock, reveal, timeout builders; script size pinned at 310 bytes",
      "tests": [
        "scalus-examples/jvm/src/test/scala/scalus/examples/htlc/HtlcTest.scala:43-65",
        "scalus-examples/jvm/src/test/scala/scalus/examples/htlc/HtlcTest.scala:91-114",
        "scalus-examples/jvm/src/test/scala/scalus/examples/htlc/HtlcTest.scala:173-194"
      ]
    },
    {
      "pass": "EscrowValidator",
      "name": "deposit: success (budget pinned), wrong signer, already funded, init amount equals escrow amount",
      "tests": [
        "scalus-examples/jvm/src/test/scala/scalus/examples/escrow/EscrowTest.scala:97-197"
      ]
    },
    {
      "pass": "EscrowValidator",
      "name": "deposit: exactly one buyer output, whole-value contract output, datum preserved, exactly one contract output",
      "tests": []
    },
    {
      "pass": "EscrowValidator",
      "name": "exactly one escrow input per transaction (double satisfaction)",
      "tests": []
    },
    {
      "pass": "EscrowValidator",
      "name": "pay / refund: success (budget pinned), not funded, missing seller/buyer output, wrong amount",
      "tests": [
        "scalus-examples/jvm/src/test/scala/scalus/examples/escrow/EscrowTest.scala:201-364"
      ]
    },
    {
      "pass": "EscrowValidator",
      "name": "pay needs the buyer's signature, refund needs the seller's signature",
      "tests": []
    },
    {
      "pass": "EscrowTransactions",
      "name": "initialize pays the initialization amount to the script",
      "tests": [
        "scalus-examples/jvm/src/test/scala/scalus/examples/escrow/EscrowTest.scala:88-93"
      ]
    },
    {
      "pass": "EscrowOffChain",
      "name": "preview-testnet runner (needs Blockfrost and mnemonics; not a unit-test target)",
      "tests": []
    },
    {
      "pass": "Factory",
      "name": "computeTokenName depends on the seed's tx id and index",
      "tests": [
        "scalus-examples/jvm/src/test/scala/scalus/examples/factory/FactoryTest.scala:21-79"
      ]
    },
    {
      "pass": "Factory",
      "name": "validateCreate: success; unsigned, seed not consumed, wrong token name, missing product output",
      "tests": [
        "scalus-examples/jvm/src/test/scala/scalus/examples/factory/FactoryTest.scala:83-339"
      ]
    },
    {
      "pass": "Factory",
      "name": "validateCreate: missing inline datum, tag mismatch, signed by a key that is not the datum creator",
      "tests": []
    },
    {
      "pass": "Factory",
      "name": "validateDestroy burns exactly one token; validateSpend needs creator signature and burns exactly its NFT",
      "tests": [
        "scalus-examples/jvm/src/test/scala/scalus/examples/factory/FactoryTest.scala:343-516"
      ]
    },
    {
      "pass": "FactoryExample / FactoryContract",
      "name": "mint/spend dispatch, policy id as spending script hash, own address must be a script",
      "tests": []
    },
    {
      "pass": "EditableNftValidator.mint",
      "name": "mint pair with seed; CIP-68 labels; rejects no seed, Burn-redeemer mint, extra names, user NFT in ref output",
      "tests": [
        "scalus-examples/jvm/src/test/scala/scalus/examples/editablenft/EditableNftValidatorTest.scala:26-264"
      ]
    },
    {
      "pass": "EditableNftValidator burn",
      "name": "burn the pair together; burning the user NFT alone is rejected",
      "tests": [
        "scalus-examples/jvm/src/test/scala/scalus/examples/editablenft/EditableNftValidatorTest.scala:266-312",
        "scalus-examples/jvm/src/test/scala/scalus/examples/editablenft/EditableNftValidatorTest.scala:529-584"
      ]
    },
    {
      "pass": "EditableNftValidator.spend",
      "name": "edit until sealed, seal, transfer then edit by new holder, edit after seal rejected",
      "tests": [
        "scalus-examples/jvm/src/test/scala/scalus/examples/editablenft/EditableNftValidatorTest.scala:314-527"
      ]
    },
    {
      "pass": "EditableNftValidator.spend",
      "name": "rejections: edit without the user NFT, token id changed, ref NFT not returned, spend-Burn without burning",
      "tests": []
    },
    {
      "pass": "LinkedListValidator / scalus.patterns.LinkedList",
      "name": "init and deinit; deinit of a non-empty list rejected",
      "tests": [
        "scalus-examples/jvm/src/test/scala/scalus/examples/linkedlist/LinkedListTest.scala:26-73",
        "scalus-examples/jvm/src/test/scala/scalus/examples/linkedlist/LinkedListTest.scala:891-935"
      ]
    },
    {
      "pass": "LinkedListValidator / scalus.patterns.LinkedList",
      "name": "appendUnordered and prependUnordered with their anchor rejections",
      "tests": [
        "scalus-examples/jvm/src/test/scala/scalus/examples/linkedlist/LinkedListTest.scala:75-282"
      ]
    },
    {
      "pass": "LinkedListValidator / scalus.patterns.LinkedList",
      "name": "ordered insert, gap insert, wrong order and duplicate key rejected",
      "tests": [
        "scalus-examples/jvm/src/test/scala/scalus/examples/linkedlist/LinkedListTest.scala:284-378",
        "scalus-examples/jvm/src/test/scala/scalus/examples/linkedlist/LinkedListTest.scala:482-719"
      ]
    },
    {
      "pass": "LinkedListValidator / scalus.patterns.LinkedList",
      "name": "insert rejected when the new key is not greater than a Node anchor",
      "tests": []
    },
    {
      "pass": "LinkedListValidator / scalus.patterns.LinkedList",
      "name": "remove and removeHead keep order and length; insert then remove is identity",
      "tests": [
        "scalus-examples/jvm/src/test/scala/scalus/examples/linkedlist/LinkedListTest.scala:380-480",
        "scalus-examples/jvm/src/test/scala/scalus/examples/linkedlist/LinkedListTest.scala:721-889"
      ]
    },
    {
      "pass": "LinkedListValidator / scalus.patterns.LinkedList",
      "name": "SpendForUpdate (validateElementUpdate) and spend-only redeemers on mint",
      "tests": []
    },
    {
      "pass": "LinkedListOffchain",
      "name": "readAll, findRoot, findNode, findAnchorFor over UTxO sets",
      "tests": [
        "scalus-examples/jvm/src/test/scala/scalus/examples/linkedlist/LinkedListTest.scala:580-889",
        "scalus-examples/jvm/src/test/scala/scalus/examples/linkedlist/LinkedListTest.scala:937-980"
      ]
    },
    {
      "pass": "LinkedListOffchain",
      "name": "readAll(reader) overload",
      "tests": []
    }
  ],
  "findings": [
    {
      "id": "C16-1",
      "check": "C6",
      "scope": "strengthen-assertion",
      "module": "scalus-examples",
      "evidence": [
        "scalus-examples/jvm/src/test/scala/scalus/examples/escrow/EscrowTest.scala:224-242",
        "scalus-examples/jvm/src/test/scala/scalus/examples/escrow/EscrowTest.scala:309-327",